{"activation":{"lane":"experimental","opt_in":true},"assumptions":{"activation":"experimental lane only; explicit opt-in per call; no frozen-core field is written","aggregation":"none; the two arithmetic means of card F02 are outside this contract","arithmetic":"IEEE-754 binary64; math.pow, math.exp and math.sqrt of the host C library","evaluation_form":"the direct expression of card F02; the logarithmic form is not used","identity":"result_id = SHA-256 of the canonical JSON of the document without result_id","membership":"exactly one explicitly declared pair; no pair is discovered, ordered or combined","parameters":"c, eta and kappa are explicit in the payload; no global, environment or default value","underflow":"a quantity strictly positive in exact arithmetic that evaluates to 0.0 is rejected, not carried","units":"declared units are compared, never converted; card F02 defines no conversion rule"},"declaration":{"category":"derived_measurement","context":"complex","pair_id":"syn-pair-1","scale":null},"diagnostics":[{"code":"INPUT_UNAVAILABLE","message":"inputs.distance_nm is declared unavailable upstream: the upstream deterministic measurement is not declared","severity":"error"}],"formulation":{"equations":{"arm_reach_nm":"r = sqrt(m)","ceff_m":"q = kappa * g","mean_square_span_nm2":"m = c * n**eta","spatial_density_nm3_inverse":"g = (3 / (2*pi*m))**1.5 * exp(-3 * d**2 / (2*m))"},"evaluation_form":"direct","formulation_id":"pointwise_measurement_v1","formulation_version":"astra-F02/1","source_card":"astra math formulation, section 3, card F02"},"inputs":{"distance_nm":{"availability":"UNAVAILABLE","quantity_definition_id":"distance_nm","unavailable_reason":"the upstream deterministic measurement is not declared","unit":"nm","value":null,"value_token":null},"segment_count":{"availability":"AVAILABLE","quantity_definition_id":"segment_count_dimensionless","unavailable_reason":null,"unit":"dimensionless","value":9.0,"value_token":null}},"intermediates":{"mean_square_span_nm2":{"quantity_definition_id":"mean_square_span_nm2","unit":"nm^2","value":null},"spatial_density_nm3_inverse":{"quantity_definition_id":"spatial_density","unit":"nm^-3","value":null}},"outputs":{"arm_reach_nm":{"category":"derived_measurement","context":"complex","domain":"finite, > 0","missing_reason":"INPUT_UNAVAILABLE: inputs.distance_nm is declared unavailable upstream: the upstream deterministic measurement is not declared","quantity_definition_id":"reach_rms_nm","quantity_id":"arm_reach_nm","scale":null,"unit":"nm","value":null},"ceff_m":{"category":"derived_measurement","context":"complex","domain":"finite, >= 0","missing_reason":"INPUT_UNAVAILABLE: inputs.distance_nm is declared unavailable upstream: the upstream deterministic measurement is not declared","quantity_definition_id":"pointwise_scalar_u","quantity_id":"ceff_m","scale":null,"unit":"U","value":null}},"parameters":{"profile_id":"syn-profile","profile_version":"1","values":{"c":{"unit":"nm^2","value":4.0,"value_token":null},"eta":{"unit":"dimensionless","value":1.0,"value_token":null},"kappa":{"unit":"U*nm^3","value":2.0,"value_token":null}}},"provenance":{"canonicalization_version":"structure_audit.provenance.canonical_json/1","execution_id":"syn-exec-1","method_id":"pointwise_measurement_v1","method_version":"astra-F02/1","model":{"checkpoint_id":null,"model_id":null,"seed":null},"pipeline_run_id":"syn-run-1","source":{"path":"/synthetic/producer/f01_distance.json","row":null,"sha256":"cccccccccccccccccccccccccccccccccccccccccccccccccccccccccccccccc"}},"result_id":"6cac70f1f48a0d8fc919fba7ffdb92bdcebd7c29a80cd70aadde5eb0a046d817","schema_version":"pointwise_measurement/1","status":"UNAVAILABLE"}